### ISSUE TITLE
Not enough capture data and incorrect IP 

### ISSUE THREAD

**Issue by shivampaw** [sfortis/pmd#1]
First of all, thanks for this!

I wasn't getting a capture finished with "-c 500" so I turned it down to "-c 20" and also tried 50 but it keeps getting my home public IP instead of the COD server.

If I run `sudo tcpdump -i any dst port 3074 -tnn` I get the following output which seems fine.
```
tcpdump: verbose output suppressed, use -v or -vv for full protocol decode
listening on any, link-type LINUX_SLL (Linux cooked), capture size 262144 bytes
IP 10.0.1.181.3076 > 185.34.104.126.3074: UDP, length 29
IP 86.168.46.166.3076 > 185.34.104.126.3074: UDP, length 29
IP 51.141.7.251.3544 > 86.168.46.166.3074: UDP, length 109
IP 51.141.7.251.3544 > 10.0.1.181.3074: UDP, length 109
IP 10.0.1.181.57346 > 185.34.107.14.3074: Flags [P.], seq 633684908:633684990, ack 3156397184, win 65465, length 82
IP 86.168.46.166.57346 > 185.34.107.14.3074: Flags [P.], seq 633684908:633684990, ack 3156397184, win 65465, length 82
IP 10.0.1.181.3076 > 185.34.107.128.3074: UDP, length 29
IP 86.168.46.166.3076 > 185.34.107.128.3074: UDP, length 29
IP 51.141.7.251.3544 > 86.168.46.166.3074: UDP, length 109
IP 51.141.7.251.3544 > 10.0.1.181.3074: UDP, length 109
IP 10.0.1.181.3076 > 185.34.104.126.3074: UDP, length 29
IP 86.168.46.166.3076 > 185.34.104.126.3074: UDP, length 29
IP 10.0.1.181.3076 > 185.34.107.128.3074: UDP, length 29
IP 86.168.46.166.3076 > 185.34.107.128.3074: UDP, length 29
IP 10.0.1.181.57346 > 185.34.107.14.3074: Flags [P.], seq 82:86, ack 67, win 65399, length 4
IP 86.168.46.166.57346 > 185.34.107.14.3074: Flags [P.], seq 82:86, ack 67, win 65399, length 4
IP 51.141.7.251.3544 > 86.168.46.166.3074: UDP, length 109
IP 51.141.7.251.3544 > 10.0.1.181.3074: UDP, length 109
IP 10.0.1.181.3076 > 185.34.104.126.3074: UDP, length 29
IP 86.168.46.166.3076 > 185.34.104.126.3074: UDP, length 29
IP 10.0.1.181.57346 > 185.34.107.14.3074: Flags [P.], seq 86:168, ack 71, win 65395, length 82
IP 86.168.46.166.57346 > 185.34.107.14.3074: Flags [P.], seq 86:168, ack 71, win 65395, length 82
IP 51.141.7.251.3544 > 86.168.46.166.3074: UDP, length 109
IP 51.141.7.251.3544 > 10.0.1.181.3074: UDP, length 109
IP 10.0.1.181.3076 > 185.34.107.128.3074: UDP, length 29
IP 86.168.46.166.3076 > 185.34.107.128.3074: UDP, length 29
```

However, as soon as I run:

```
tophost=`sudo tcpdump -tnn -c 20 -i any dst port 3074 | awk -F "." '{print $1"."$2"."$3"."$4}' | sort | uniq -c | sort -nr | head -1 | awk '{print $3 "\t"}'` >/dev/null 2>&1 
srvip="$(echo -e "${tophost}" | sed -e 's/^[[:space:]]*//' -e 's/[[:space:]]*$//')"
echo "Server detected : $srvip"
```

The output is: `Server detected : 86.168.46.166` which is my public IP.

Any ideas why this is happening?

Thanks :)

**Comment by sfortis** [comment]
hey @shivampaw 

can you run this command and verify that top host is not your public ip?

tcpdump -tnn -c 500 -i any dst port 3074 and not src port 3074 | awk -F "." '{print $1"."$2"."$3"."$4}' | sort | uniq -c | sort -nr

**Comment by shivampaw** [comment]
Is it ok to run that with -c 10?

**Comment by sfortis** [comment]
no ,10 packets are very few for reliable results. i recommend minimum 150-200

**Comment by shivampaw** [comment]
That's weird because if I do anything above 100 the packet capture won't finish before the match ends.

**Comment by sfortis** [comment]
hmm..which model is your router?

lets try another approach, capture the bridge interface and the traffic from your 3074 port 

can you paste the results? 

tcpdump -tnn -c 100 -i br0 src port 3074 and not dst port 3074

**Comment by sfortis** [comment]
also something important! the NAT acceleration should be DISABLED (Lan --> switch control) or else tcpdump will not capture the NAT'ed traffic.

If you disable the NAT acceleration, most probably the original command will work fine.

**Comment by sfortis** [comment]
@shivampaw did you manage to capture the server ip's?

**Comment by shivampaw** [comment]
I'm using a Unifi USG route (not asus). It has a ssh and tcpdump works fine when I've used it in the past.

It has a hardware offloading option, should I turn that off?
https://help.ubnt.com/hc/en-us/articles/115006567467-EdgeRouter-Hardware-Offloading-Explained

Thanjs

**Comment by sfortis** [comment]
yes, its the same concept. hwnat, nat acceleration like asus. disable this and try again!

**Comment by shivampaw** [comment]
Tried that and it took around 4-5 minutes for the capture to finish 300 but still showed my public IP. Giving it another go now though. Also running 

```
sudo tcpdump -tnn -c 100 -i any dst port 3074 and not src port 3074 | awk -F "." '{print $1"."$2"."$3"."$4}' | sort | uniq -c | sort -nr
```

As well and will post those results.

**Comment by shivampaw** [comment]
```
ubnt@USG:~$ sudo tcpdump -tnn -c 100 -i any dst port 3074 and not src port 3074 | awk -F "." '{print $1"."$2"."$3"."$4}' | sort | uniq -c | sort -nr
tcpdump: verbose output suppressed, use -v or -vv for full protocol decode
listening on any, link-type LINUX_SLL (Linux cooked), capture size 262144 bytes
100 packets captured
114 packets received by filter
0 packets dropped by kernel
     49 IP 10.0.1.181
     48 IP 86.168.46.166
      3 IP 51.141.7.251
```

**Comment by shivampaw** [comment]
I'm in the UK so I'd be pretty concerned if I was hosting all these games tbh...any ideas? Really appreciate this!

**Comment by sfortis** [comment]
you should be able to capture 500 packets in a matter of seconds. the game has a 60hz tickrate, meaning 60 udp packets / second.

i guess that your router is handling different the interfaces, so i recommend to try different ones ( you can see all the available with "tcpdump -D" parameter. Try the br0 and ppp0 instead "any" all in the -i parameter. Also i recommend to try withound specific condition (ie remove the "dst port 3074 and not src port 3074") to see which interface will give you the incoming NAT'ed packets.

you should see the most of the packets coming from game server and only a few from other hosts or your public ip. 


# tcpdump -tnn -c 100 -i br0 dst port 3074 and not src port 3074 | awk -F "." '{print $1"."$2"."$3"."$4}' | sort | uniq -c | sort -nr
tcpdump: verbose output suppressed, use -v or -vv for full protocol decode
listening on br0, link-type EN10MB (Ethernet), capture size 262144 bytes
100 packets captured
104 packets received by filter
0 packets dropped by kernel
     95 IP 45.63.102.140
      3 IP 192.168.1.22
      1 IP 77.136.85.250
      1 IP 188.210.56.246

ps. no its impossible to host every game. UK has many servers. Use https://www.iplocation.net/ and you'll see that some of the top IP's is a game server. 

i've found these so far:

176.26.232.123 United Kingdom
45.63.102.100 United Kingdom
45.63.102.139 United Kingdom
45.63.102.69 United Kingdom
45.63.103.141 United Kingdom
108.61.116.130 United Kingdom
45.63.102.131 United Kingdom

**Comment by shivampaw** [comment]
sudo tcpdump -D return this:
```
ubnt@USG:~$ sudo tcpdump -D
^[1.eth0 [Up, Running]
2.imq0 [Up, Running]
3.pppoe0 [Up, Running]
4.ifb_pppoe0 [Up, Running]
5.eth1 [Up, Running]
6.any (Pseudo-device that captures on all interfaces) [Up, Running]
7.lo [Up, Running, Loopback]
8.bluetooth-monitor (Bluetooth Linux Monitor)
9.nflog (Linux netfilter log (NFLOG) interface)
10.nfqueue (Linux netfilter queue (NFQUEUE) interface)
11.usbmon1 (USB bus number 1)
```

It says any should capture on all interfaces and I checked the others and any did return the most packets (followed by eth1)
